{
  "$schema": "http://json-schema.org/draft-07/schema#",
  "title": "OpenHuman Profile Schema",
  "type": "object",
  "properties": {
    "name": { "type": "string" },
    "handle": { "type": "string" },
    "title": { "type": "string" },
    "tags": {
      "type": "array",
      "items": { "type": "string" }
    },
    "now_playing": { "type": "string" },
    "building": {
      "type": "array",
      "items": { "type": "string" }
    },
    "open_to": {
      "type": "array",
      "items": { "type": "string" }
    },
    "contact": {
      "type": "object",
      "properties": {
        "twitter": { "type": "string" },
        "email": { "type": "string", "format": "email" }
      },
      "required": ["email"]
    },
    "vibe_score": { "type": "integer", "minimum": 0, "maximum": 100 }
  },
  "required": ["name", "handle", "title", "tags", "contact"],
  "additionalProperties": false
} 